Date,Text
19900102,"[A-4 Cb?cttc, Montreal, Tuesday, January 2, 1990

TOE PROVDMCE

Veteran

By EDDIE COLLISTER of The Gazette

Coroner Roch Heroux, the man charged with probing the baffling, controversial deaths of three men in 1989, is a veteran of more than 5,000 inquests who admits he's afraid of the dead and of dying. ""I never look at photographs of the corpses,"" Heroux said in a recent interview in his 18th-floor office in Complexe Desjardins' East Tower. ""When the photos are produced I pretend to view them for a few moments, then hand them over to the clerk to enter as exhibits. The testimony of witnesses is hard enough to take at times and I don't have to look at gory pictures to make my rulings."" Heroux is a former Crown prosecutor who has been a coroner since January 1973. Dr. Jean Grenier, Quebec's chief coroner, assigned Heroux the inquests into the deaths of Olympic gold medallist Victor Davis, 25, Quebec game warden Luc Guindon, 29, and F. Kingsley Doody, 81, after the Crown ruled there wasn't enough evidence to support criminal charges.

Likes lots of work

Heroux, a poet and former librarian, is looking forward to presiding over the inquests. ""I like it when I have lots of work,"" said the 66-year-old coroner, who is known for his emotional outbursts on the bench, especially when probing deaths of children. ""Children are so trusting, so naive,"" said the man who has no children of his own. ""It pains me when they die needlessly, especially when they're made to suffer beforehand."" Heroux said he didn't keep close tabs on press coverage of the three high-profile cases he's been assigned. ""I have to base my rulings on what witnesses tell me, so I don't pay much attention to what's said or written in the media. All I know is that there's a lot of interest in the cases, especially in the English-speaking community."" Davis died in hospital Nov. 13, a couple of days after he was struck by a car outside a Ste. Anne de Bellevue brasserie. Guindon, 29, one of this province's 450 game wardens, was killed in the woods near Ste. Agathe when a bolt from a crossbow, fired by an alleged poacher, pierced his heart. The inquiry into Guindon's death is set for Jan. 22-23 at St. Jerome. No dates have been set for the other inquests. Doody died Oct. 2 at the Montreal General Hospital. The retired insurance executive and veteran suffered rib and hip fractures in an Aug. 31 incident at the Hillside Tennis Club. Doody fell down stairs.

Two men die in highway accident as freezing rain makes roads icy

By TU THANH HA of The Gazette

Two motorists, including a Montreal man, were killed after freezing rain falling over the province on New Year's Eve left roads slippery with ice. Jimmy Patacki, 27, of Montreal died on Highway 10 near Granby when the car he was driving slammed into the side of a tow truck parked on the left westbound lane, police said. One passenger, Patrick Plourde, 60, of Bonneville, Alta., died in the afternoon at the Centre Hospitalier de Granby, said Sgt. Michel Gamache, a Sûreté du Quebec officer in Sherbrooke. Three other passengers were injured in the collision. The collision happened after 2 p.m. at a spot where eight cars had slid into ditches after drivers lost control on the ice. Following the accident, Highway 10 was closed briefly in both directions, Transport Quebec official Claude Laforest said. No major road accidents were reported yesterday, Sûreté Const. Robert Poeti said. Highways in Montreal were in good condition and the situation on Highway 10 was ""becoming normal,"" said Transport Quebec official Alain Legault. Sunday was the first time since Dec. 6 that temperatures were above zero, Steve McCusky of the Dorval weather office said. Sunday's recorded high at Dorval was 3 degrees Celsius and freezing rain turned to light rain by afternoon. Yesterday, the mercury dropped from -1 C in the morning to -8 C at 11 p.m. Today is expected to be sunny with winds of 15 to 30 kilometres per hour and a high of -3 C. In the Montreal area, at least 13,000 households were left without electricity Sunday when the freezing rain seeped into underground cables or short-circuited power lines on utility poles. About 6,000 Hydro-Quebec customers were blacked out on Montreal Island, mostly in Outremont, Anjou and east-end Montreal. On the South Shore, 4,000 Hydro customers, mostly in Brossard, St. Hubert and Greenfield Park, were affected. In Laval, about 3,000 Hydro users in the Chomedey and St. Francois districts lost power. In Pincourt, 200 households were also blacked out. The power failures were repaired by Sunday evening.

The contract, scheduled to begin in May, is for a minimum of 340 megawatts and the utilities have an option to buy another 110 megawatts. The Public Service Department endorsed only the first 340 megawatts. ""Before the additional capacity is required, it has to be shown that the need couldn't be satisfied by energy conservation programs,"" Dutton said. Brian Craik, an adviser to the Grand Council of the Cree, said he is still optimistic the Public Service Board will turn the contract down. Jim Higgins, a member of the New England Coalition for Energy Efficiency and the Environment, said the department did not consider all the evidence that the board will have to consider. ""The department was looking less at the environmental aspect and more at the economics,"" he said.

Thieves steal cash, drugs from RCMP detachment

VANCOUVER (CP) - RCMP in suburban Langley seem a little embarrassed about a recent break-in at their own detachment. Thieves made off with cash and drugs over the Christmas holidays. The Mounties were too busy elsewhere to notice, said Staff Sgt. Peter Obrowski. ""We had stabbings, impaired drivers, domestic disputes and every single available person was working,"" he said. The police kept details to a minimum. ""We had a break-in sometime between Dec. 22 and Dec. 27, and the thieves got away with some drugs and cash,"" said Insp. David Mortimer. Mortimer refused to say how they gained entry or how much they stole. ""The more we keep back the better for the investigation.""

Four dead in Ottawa-area nursing home fire

GLOUCESTER, Ont. (CP) - An Ontario fire marshal will order forensic tests today to determine the cause of a fire that killed four people yesterday in a home for the elderly. The four died after dense smoke poured through their rooms in the Rembrandt Manor in an Ottawa suburb. Nineteen more were saved from the 3 a.m. blaze which took firefighters only minutes to douse. Dr. James Dickson, the Ottawa coroner, believes all four died of smoke inhalation and will decide whether to hold an inquest once the fire's cause is known. Les McPhee, an Ontario fire marshal, said the fire appeared to start in a corridor near or inside a linen cupboard. He plans to order forensic tests today to determine the cause. The victims were Frederick Armstrong, 73, Laura Borges, 83, Elzear Guilbault, 61, and Freda Haddad, 90. Four residents were admitted to hospital, one in critical and three in fair condition. The other residents were taken to another home for the elderly where they will stay until the home can reopen. Stephanie Baraniak, one of the residence's six co-owners, said Judy Boucher, the only nurse on duty New Year's Eve, moved residents in areas away from the fire into the chapel in the north wing. ""But she hadn't been able to reach the residents where the fire was,"" Baraniak said. Baraniak said she and her husband arrived at the fire and firefighters began to remove the residents, many of them overcome by smoke. ""Then we reached one bedridden resident we were concerned about.""

What more can I say? Co-owner Jean Vinet said all residents were able to get around without assistance. But relatives said three of the dead had been unable to walk unassisted. Armstrong's legs had been amputated, and he had recently suffered a stroke. Haddad had been confined to a wheelchair for 10 years and Guilbault could only walk unattended at an extremely slow pace. Rembrandt Manor is a supervised residence for seniors. Unlike nursing homes, it is not licensed or regulated by the province, nor are any of its fees paid by any provincial healthcare program. The residents pay the entire fee, which ranges from $25 to $35 a day. Question staffing Carole Armstrong, daughter-in-law of one of the victims, said the family was unaware the home was unlicensed. However, she said her father-in-law seemed ""happy with the care."" Ray Guilbault, son of victim Elzear Guilbault, questioned having one staff person on duty. ""I think she (Boucher) did one super job under the circumstances, but if there had been more people maybe some lives could have been saved. It's very sad. Maybe these institutions should be scrutinized more carefully.""

Showman recalls life on the road

GLENBORO, Man. (CP) - In the days before television, the showman visited southern Manitoba's rural schools and churches not only to thread National Film Board productions but to let viewers debate them. Gerry McLeod, 79, was among a handful of travelling projectionists on the Prairies from 1939 to the 1950s who were commonly known as showmen. ""The guys who were in it, were in a sense, evangelists,"" he said at his home in this rural community 170 kilometres west of Winnipeg. ""Not in the religious sense but with a message to build a better Canada,"" McLeod said. ""We were prepared to work long hours to get this across."" McLeod joined the National Film Board, which celebrated its 50th anniversary this year, in 1946 after he served with the signal corps in the Second World War. He travelled Prairie roads during harsh winters and dusty summers in a second-hand Chevy, and by the late 1940s was visiting 55 schools. ""It's all very well to make films but you had to have some system of getting the films to the people, and that's what led to the travelling projectionist,"" he said. Part of McLeod's duties was also to stimulate discussion after each visit. Although television ended the days of the travelling showmen, McLeod stayed with the NFB until his retirement in 1973. He devoted much of his time setting up local film clubs in school libraries. The film distribution system garnered a worldwide reputation as government officials from China and India attempted a similar process.]"
19900103,"[Y And his fight against Benn had already been postponed to later this month because of a kitchen accident two weeks ago which left a small gash on his right hand. ""I've paid my dues,"" said Olajide, who announced himself fit and ready to resume full training next week. ""This is a good opportunity for me and I'm going to put everything on the line in this fight."" 

Even ice fishermen chilled by winter. Though the weatherman had promised warmer temperatures, even Saturday's sunshine failed to prod the mercury up enough to herald the start of the warming trend. It was cold out on the ice of Montreal-area waters, bitterly cold, and when darkness closed in, it grew colder yet. Few anglers ventured out to face a wind-chill capable of freezing skin in just minutes; those who did were able to endure the elements just long enough to set up their rigs, but once the warmth from the exercise had dissipated, the full measure of the cold hit home. Even baiting the hooks was a painful procedure. 

But on the Riviere des Prairies, the walleye seem unaware of the bitter cold above the surface; they're still hitting as well as they were all December long. ""And that's a lot better than I've seen in more than two decades of winter walleye fishing."" Tip-ups baited with four-inch shiners on number four hooks are consistently effective, but last weekend jigging produced a fair share of walleye as well as a number of hefty perch, most of them females already starting to swell, three months away from their spawning season. My terminal tackle consisted of a 1½-inch action tube black head and yellow skirt on an unpainted, 1/32-ounce jig head; above that I tied in a dropper line and an artificial ice-fishing grub. The terminal line was three-pound test monofilament. 

""I've always had the best success on the ice grubs, but last Saturday both the perch and walleye showed OUTDOORS George Gruenefeld a definite preference for action tubes."" It may have simply been a function of color, but the thought of snipping off one ice-fishing grub and then trying to tie an improved clinch knot on another in the numbing cold chilled any temptation to experiment. If the fish were willing to take at least one of my offerings, that was plenty good enough. 

One purpose for enduring last Saturday's cold was to test a new type of monofilament under the most adverse possible conditions and you couldn't get more adverse than last Saturday south of the sub-Arctic. Most monofilament lines pick up beads of ice as they are raised and lowered; and if these beads are not constantly removed, they quickly grow into a sheath of ice in the same way as a candlemaker creates hand-dipped tapers by dipping the wick in and out of molten wax. For some reason, black graphite monofilament seems to resist this tendency for ice to bead on the line and, even when it does, the few minute particles can be easily removed by simply running it between gloved thumb and fingers. 

Neither the manufacturer Tortue of France nor the Canadian distributor are apparently aware of the line's ice-repelling property. I spooled my ice fishing reel, an ultralight spinning reel with five-pound test, though six or eight-pound test might have worked just as well since I use a three-foot terminal leader of clear monofilament. Two years ago, the Montreal office of the provincial fish and game department started a perch tagging program on Lake St. Louis to learn something about the population dynamics of these popular game fish. Since that time, a total of 20,000 fish have been adorned with the blue plastic tags. 

Unfortunately, surprisingly few of the tags—only 470 of them in two seasons—have been returned to the department, either because the tagged fish have learned to be suspicious of man's activities or because anglers have become suspicious of the department's activities. In hopes of getting a better response this winter, the department has issued a reminder to anglers on Lake St. Louis that when they catch a tagged perch, they should put the tag in an envelope and send it to the Department of Recreation, Hunting and Fishing, Wildlife Management and Exploitation Service, 6255 13th Avenue, Montreal, Quebec H1X 3E6. 

In return for their trouble, the department promises them a brochure (in French), a certificate of recognition (in French), an arm patch (in French), and an O'Keefe cap (not necessarily in French). Anglers who fished for Atlantic salmon on the York and Dartmouth Rivers at the tip of Quebec's Gaspe Peninsula last season should check their mail carefully these days because, among the bills, they'll likely find an envelope from the Societe de gestion des rivieres York et Dartmouth, the organization which manages these two streams. 

The envelope contains a handful of entry blanks to take part in the drawing for prime salmon fishing beats this coming summer. Though only five forms are sent by the association to keep costs down in the general mailing, additional application blanks are available by contacting the association. Any number of entry forms can be submitted by any one person, but there is a nonrefundable fee of $4 for each entry. Sending in several dozen completed cards can get expensive and, while the odds of being drawn are improved as the number of cards sent increases, submitting a whole stack of entry forms is no guarantee of getting decent water. Bear in mind that any one angler can reserve no more than three days of fishing between the two rivers. 

Deadline for entries is Feb. 15 and the drawing takes place on Feb. 17 at the ZEC office in Gaspe. The 250 successful applicants are called in the order that they are drawn; in other words, the first name drawn has first choice. Anglers who need more entry blanks or have not received the forms for the drawing can call the ZEC York-Dartmouth at (418) 368-2324 or write to the Societe de gestion des rivieres York et Dartmouth.]"
19900104,"[Cbe&xietU, Montreal, Thursday, January 4, 1990 A-3

Messages

By TU THANH HA of The Gazette

For nearly a month now since Marc Lepine shot 14 women dead at Ecole Polytechnique, telegrams, letters and poems from mourners have been collected on four walls near a sixth-floor student lounge. Yesterday, the final flowers and photos of the victims were added to complete the memorial at the engineering school which will open officially tomorrow at 5 p.m. With the skies darkening outside the bay windows, a few students passed briefly by the display, taking a break from studying for their exams which were delayed until January because of the massacre. Among the tables covered with scores of condolence cards, the portrait photos of the victims were placed in glass displays. ""The first week after, no one felt like studying. It was hard to get yourself into that,"" said Louise Boudreault, a first-year student preparing nearby for her chemistry exam. The closeness students felt toward each other after the shooting may fade as academic worries return, one doctoral student said. ""Like any other grief, you have to get over it,"" he said. The doctoral student said he still wonders whether students could have done something to stop the gunman. Simon Hamel, a third-year electrical engineering student, also wondered if things could have been different. Hamel who, on Dec. 6, helped others.

Icy sidewalks are blamed for rash of injuries!

An increasing number of elderly people are being treated for injuries following tumbles on icy sidewalks, local hospital officials said yesterday. And the changing weather conditions are being blamed by the city of Montreal's public works for the slippery situation. ""The city is trying to give better service but it's almost nullified because the sand is washed away by rain, then it gets colder and it freezes again,"" said Diane Leduc, a public works official. Since Jan. 1, many patients, most of them elderly, have been treated at the Jewish General Hospital for hip or wrist fractures and sprains related to the icy conditions, said Dr. Marc Afilalo, director of the emergency ward. ""We don't keep a tally but from our experience it's really enormous,"" he said. ""It's really incredible the number of fractures we've seen."" Between the evening of Dec. 31, the day freezing rain started, and the morning of Jan. 2, about 10 patients were treated for injuries from falls, Afilalo said. Normally, the Jewish General treats two or three such patients in a week, he said. At the Montreal General there was a 10-per-cent increase in injuries from falls on ice, said Dr. Michael Churchill-Smith, head of emergency-room medical services. ""But we expect that when we see weather like this,"" he said. Higher numbers were also reported at the Lakeshore General Hospital and the Royal Victoria Hospital. Today, freezing rain is again forecast for the afternoon, with an expected high of 2 degrees Celsius. 

How to prevent injuries? Slow down when it's icy or dark, Afilalo said. ""And for older people, limit their going out.""

Tu Thanh Ha

Bell struggling to repair underwater phone lines

About 1,200 Bell Canada subscribers in Laval's Ste. Dorothee district begin a second week without regular service today. A repair crew managed yesterday to anchor a barge into position on Riviere des Prairies near an underwater cable that failed a week ago today. But they were unable to lift the cable before dark, said Jean-Claude Hamel, an information officer for the utility. Bell has also beefed up temporary service to the area. A truck equipped to make free calls has been parked at Jolicoeur and Bord de l'Eau Sts, closer to many of the affected residents than 16 free public phones made available last Saturday near Ste. Dorothee Roman Catholic church.

Slain woman identified

The woman found bludgeoned to death in her apartment on 1st Ave. in Pointe aux Trembles Tuesday was identified yesterday as Jacqueline Bernard, 50. The detective in charge of the case, Lieut. Claude Lachapelle, said Montreal Urban Community police were exploring several leads yesterday but had no further details about the city's first slaying of 1990. No murder weapon had been found. On Tuesday police said Bernard's head had been bashed in with a blunt object. An autopsy was being performed yesterday but results were not available.

C-8

Montreal, Thursday, January 4, 1990

Today's Low: -2

Records: Maximum 12 (1950) Minimum -35 (1981)

Regional forecast

Forecast issued at 7:30 p.m. last night covers highs for today and overnight lows between tonight and tomorrow. Temperatures are given in degrees Celsius.

Montreal Today

Cloudy skies with a chance of freezing rain this afternoon.

Montreal Tomorrow

Clear skies and colder temperatures. High near -8.

Ottawa (High: 2 Low: -3) St. Jovite (High: 2 Low: -4) 

Temperature conversion

Sunrise 7:35 Sunset 4:25

Regional synopses

Abitibi-Lac St. Jean High -1 Low near -5 Cloudy with scattered flurries, clearing later this evening.

Laurentians High 1 Low near -2 Cloudy with rain mixed at times with freezing rain or snow.

Eastern Ontario High 2 Low near -3 Cloudy with rain or freezing rain early in the afternoon.

Southern Ontario High -3 Low near -9 The forecast calls for cloudy skies with a chance of flurries.

Quebec City High 1 Low near -2 Cloudy with a mixture of snow, rain, and freezing rain falling all afternoon.

Eastern Townships High 3 Low near -2 Cloudy with freezing rain in the morning followed by light rain or flurries.

New England High 6 Low near 0 The outlook is for cloudy skies and periods of rain throughout the region.

Lower North Shore High -4 Low near -12 About 5 centimetres of snow is expected to fall throughout the day.

Gaspe High 2 Low near -12 Cloudy skies with snow, possibly mixed with freezing rain this afternoon.

Almanac

Yesterday Year ago yesterday Average this date Max Min -1 -5 -21 -6 -14

Canada Max Min World

Whitehorse Snow -17 -20 Amsterdam Fog 4 0 Yellowknife Cloudy -30 -34 Athens Cloudy 10 5 Vancouver Rain 8 3 Beijing Clear 3 -7 Prince Rupert Rain 6 1 Buenos Aires Pcldy 30 18 Kamloops Rain 8 2 Copenhagen Cloudy -1 -4 Edmonton Snow -10 -17 Dublin Rain 9 5 Calgary Snow -5 -10 Frankfurt Cloudy -1 -1 Saskatoon Snow -14 -23 Hong Kong Cloudy 17 15 Regina Snow -11 -18 Jerusalem Clear 14 8 Winnipeg Clear -15 -22 Lisbon Rain 15 9 Thunder Bay Clear -10 -18 London Cloudy 5 4 Sudbury Cloudy -3 -5 Madrid Cloudy -18 5 Toronto Cloudy -3 -9 Mexico City Clear 24 4 Fredericton Cloudy 4 0 Moscow Snow -5 -12 Halifax Pcldy 5 3 New Delhi N/A 14 5 Charlottetown Cloudy 3 2 Paris Fog 4 -1 St. John's Clear -1 -3 Rome Clear 12 -2

Stationary Front Trough

For free weather information, updated four times a day, please call Gazette Info-Line, 521-8600, code: 6800.

Dear Ann: Because]"
